music_index,album_index,singer_index,singer,song,album,lyrics,genre,music_titme,album_released,time,activity,emotion
4646573,2256290,261143,IU (아이유),너의 의미 (Feat. 김창완),꽃갈피,너의 그 한 마디 말도 그 웃음도  나에겐 커다란 의미  너의 그 작은 눈빛도  쓸쓸한 그 뒷모습도 나에겐 힘겨운  약속  너의 모든 것은 내게로 와  풀리지 않는 수수께끼가 되네  슬픔은 간이역의 코스모스로 피고  스쳐 불어온 넌 향긋한 바람  나 이제 뭉게구름 위에 성을 짓고  널 향해 창을 내리 바람 드는 창을  너의 그 한 마디 말도 그 웃음도  나에겐 커다란 의미  너의 그 작은 눈빛도  쓸쓸한 그 뒷모습도 나에겐 힘겨운  약속  너의 모든 것은 내게로 와  풀리지 않는 수수께끼가 되네  슬픔은 간이역의,발라드,196,2014-05-16,봄_새벽,산책/걷는중,사랑
4711065,2263475,203912,윤하 (YOUNHA),우산,우산,어느새 빗물이 내 발목에 고이고  참았던 눈물이 내 눈가에 고이고  I cry 어딜 가도 떠있는 내 작은 먹구름 까치발 딛고 잡아보려고 해도 키가 닿지 않아 항상 손끝 위에  어느새 빗물이 내 발목에 고이고 참았던 눈물이 내 눈가에 고이고  I cry 그대는 내 머리위에 우산 어깨위에 차가운 비 내리는 밤 내 곁에 그대가 습관이 돼버린 나 난 그대 없이는 안돼요 alone in the rain 어딜 가도 내 뒤를 쫓는  나만의 먹구름 창문을 닫고 끝내 눈을 감아도 곧 나를 깨우는 차가운 한방울 어느새 빗물이 내 발목에 고이고 참았던 눈물이 내 눈가에 고이고  I cry 그대는 내,발라드,292,2014-07-02,가을_새벽,휴식/수면,슬픔
4714217,2263804,100007,god,하늘색 약속,Chapter 8,세상엔 우리들만큼 누군가를 그리워하는 사람들이 많습니다 지금도 누군가를 그리워하고 있을 그 친구들에게 이 노래를 바칩니다 모여라 얘들아 왜 이렇게 사는 게 힘들기만 한지 어느새 서른 중반 맘엔 멍이 들지 도대체 뭘 잘못했길래 내게만 이래 전생에 뭔 죄를 졌길래 안 보이는 미래 시간은 가고 나이는 차고 결혼은 자꾸 왜 안 하냐고 향수로 가리는 내 총각냄새 사라져가는 꿈 내 거친 텃새 god 이젠 빅 대디 아빠 어디가 나가야 할까 god와 JYP 그 때 그 시절 그리워 서일까 오늘밤 같이 뛰고 같이 불러줘 우리 웃으면서 노래해 헤어질 때 우리 다시 만나자고 맹세했던 그 약속 지키려고 하늘색 풍선 가득했던 You and Me 오래 기다리게,발라드,261,2014-07-08,봄_아침,차량/운전중,슬픔
4734489,2265100,629831,에일리(AILEE),I'm In Love,re;code Episode V,Im falling in love 알고 있나요 매일 그대만 생각해요 함께 있고 싶죠 언제부턴가 그대는 내 전부가 됐고 그대 없인 하루도 살 수가 없죠 I know 영원한 건 아무것도 없죠 믿고 싶어요 변하지 않길 만약 그대 나를 좋아한다면 날 사랑한다면 Let me know tell me please baby 난 그대만 생각할게요 오 그대에게 말할게요 love you 내 삶이 변한 거죠 그대도 나와 같은가요 Bye Bye sadness Hello my love 내 곁에 있어줘요 Its so amazing to be in love 그때 이미 시작한 거죠 사랑이란 건 우연이 아니라는 걸 운명이란 걸 만약 그대 나를 좋아한다면  날 사랑한다면 Let me know tell me,발라드,262,2014-07-11,봄_아침,산책/걷는중,슬픔
4762446,2268823,715176,첸 (CHEN),최고의 행운,괜찮아 사랑이야 OST Part 1,아무래도 난 니가 좋아 아무런 말도 없이 웃던 나를 안아줘 babe 오늘을 기다렸죠 그대 달콤한 나를 봐요 그대 ye 지켜줄게요 babe 매일 매일 꿈을 꾸죠 그대 손을  잡고 날아가 영원히 언제 까지나 보고 싶은 나의 사랑 운명 이죠  피할수도 없죠 every day Im so lucky 숨겨왔던  내 맘을 고백 할래 너를 사랑해 떨리던 내 입술도 그대 설레던 이 마음도 그대 내 사랑이죠 babe 이런게 사랑 인걸 알죠 그대가 있어 행복 하죠 ye 사랑이예요 babe 매일 매일 꿈을 꾸죠 그대 손을  잡고 날아가 영원히 언제 까지나 보고 싶은 나의 사랑 운명이죠  피할수도 없죠 every day Im,발라드,226,2014-07-23,봄_새벽,산책/걷는중,슬픔
4779294,2270673,236815,다비치,괜찮아 사랑이야,괜찮아 사랑이야 OST Part 2,내 맘이 보이니 왜 사랑인거니 다시는 하지 말자던 사랑  참 많이 바보 같지 왜 행복 한 거니 니 얼굴이 떠올라  내 곁에만 있어줘 영원히 너를 꽃 흔들리듯 바람에 니가 다가와  내 맘 두드리던 그런 너를 사랑해 가슴이 아파 널 보면  괜찮아 사랑이야 부족한 이 맘을 또 나를 사랑을 받아 줄수 있겠니 나를 왜 웃기만 하니 내 눈을 바라보며 이 떨림을 간직해 나를 안아줘 꽃 흔들리듯 바람에 니가 다가와 내 맘 두드리던 그런 너를 사랑해 가슴이 아파 널 보면  괜찮아 사랑이야 부족한 이 맘을 또 나를 사랑을 받아 줄 수 있겠니 나를 이런 나를 사랑해줘 ,발라드,245,2014-07-30,겨울_새벽,운동/훈련중,슬픔
4786735,2271467,566431,마크툽 (MAKTUB),Marry Me,마크툽 프로젝트 Vol.03,비내리는 날엔 우산이 돼주고 어둠이 오면 빛이 돼줄게 추운 겨울이면 난로가 돼주고 더운 날엔 바람이 될게 잠이 들 때까지 머릴 만져줄게 니가 두려울 때마다 꼭 옆에  있어줄게 갑작스런 맘에 문득 떠나고 싶으면 내일 무슨 일이 있어도 함께  떠나줄게 Marry Me 내 손 잡아줄래요 Marry Me 나와 평생 함께 할래요 남은 나의 모든 삶 오직 그대 남자로 살고 싶어요 Marry Me darling 나와 결혼해줄래요 순간뿐이 아냐 많이 생각했어 헌데 내 사랑을 줄 수 있는 여잔  너밖에 없어 차갑고 어두운 험하고 쓸쓸한 세상 속 평생의 동반자로 함께 걸어가고 싶어 Marry Me 내 손 잡아줄래요 Marry Me 나와 평생 함께,발라드,262,2014-08-04,겨울_아침,운동/훈련중,안정
4843704,2277787,1654,윤미래,너를 사랑해,괜찮아 사랑이야 OST Part.6,오랜시간 함께라서 내 친구로  난 너무도 편했었어  이게 사랑인줄 모르고 지냈어  그래 그래왔어  널 못보면 보고 싶고 내 꿈속에  니가 자꾸만 나타나고  매일 잠도 못자 눈물로 지냈어  너의 거절이 난 두려워서  오늘도 또 또 못하는 그말  집앞에 서서 준비했던 말  나 꿈에서라도 그 꿈에서라도  너의 눈을 보며  고백하고 싶은 소중한 말  내일은 정말 꼭꼭 해보고 싶은말  용기조차 없어 못했던 말  나는 겁이 나서 너무 무서워서  니가 멀어질까  오랫동안 못했던 말  너를 사랑해  가끔 너는 술에 취해  늦은밤 날 보고 싶다는,발라드,243,2014-08-27,가을_새벽,산책/걷는중,슬픔
4864206,2279896,192827,어쿠스틱 콜라보,"묘해, 너와",연애의 발견 OST Part 4,니 생각에 꽤 즐겁고  니 생각에 퍽 외로워  이상한 일이야   누굴 좋아한단 건  아무 일도 없는 저녁  집 앞을 걷다   밤 공기가 좋아서  뜬금없이 이렇게   니가 보고 싶어 참 묘한 일이야 사랑은  좋아서 그립고   그리워서 외로워져  이게 다 무슨 일일까  내 맘이 내 맘이 아닌걸  이제와 어떡해   모든 시간 모든 공간  내 주위엔 온통   너뿐인 것 같아 묘해  보고 싶어 신기하고  신기해서 보고 싶고  그러다 한 순간   미친 듯 불안하고  아무렇지도 않은데,발라드,231,2014-09-02,봄_새벽,산책/걷는중,사랑
5386171,2282532,192827,어쿠스틱 콜라보,너무 보고싶어,연애의 발견 OST Part 6,혼자 이별을 하고  가버리면 난 어떡하라고 너 없는 하루를 살아보고  너 없는 채로 잠들어본다 잊을 수 있다고 다짐을 해 보고 다 잊은 척 웃어도 보고 별일 아닌 듯 혼자 영화도 보고  너의 빈자리 채워 본다 가끔 보고 싶어 견디기 힘들면 나 하루 종일 너를 찾아 헤매보고 손잡고 걷던 거리에 우두커니 서서 혹시 니가 올까 가슴 설레 본다 잘 살 수 있다고 다짐을 해 보고 태연한 척 웃어도 보고 드라마처럼 혼자 취해도 보고 널 잊으려고 하면 할수록 너무 보고 싶어 견디기 힘들어 비틀거리며 너를 또 찾아 헤매고 나란히 걷던 이 길에 나만 혼자  남아 눈물 삼키면서 너를,발라드,245,2014-09-18,가을_새벽,휴식/수면,슬픔
5388806,2282848,770167,곽진언,당신만이,슈퍼스타K6 곽진언 김필 임도혁,눈부신 햇살이 비춰주어도  제게 무슨 소용있겠어요  이토록 아름다운 당신만이  나에게 빛이 되는걸  그대여 안녕이란 말은 말아요  사랑의 눈빛만을 주세요  아 이대로 영원히  내 사랑 간직하고파  눈부신 햇살이 비춰주어도  이젠 무슨 소용있겠어요  이토록 아름다운 당신만이  나에게 빛이 되는걸  그대여 안녕이란 말은 말아요  사랑의 눈빛만을 주세요  아 이대로 영원히  내 사랑 간직하고파  영원히 그대와 당신만이,발라드,258,2014-09-20,겨울_저녁,휴식/수면,슬픔
5398990,2284064,711476,한동근,이 소설의 끝을 다시 써보려 해,The 1st Digital Single '이 소설의 끝을 다시 써보려 해',시계가 반대로 돌아가고 있어 TV속 영화가 되감아지고 있어 내렸던 빗물이 올라가고 있어 잊었던 기억이 돌아오고 있어 도로 위에 차들이  반대로 달리고 온 세상의 모든 게 다  거꾸로 움직여 지금 나는 계속 반대로  뒷걸음질 치며 그날의 너에게 돌아가고 있어 운명 같은 만남 너무 아픈 결말 난 이 소설의 끝을  다시 써보려 해 내 한 권의 사랑 마지막 장면엔 니가 있어야 해  그래야 말이 되니까 한 장씩 한 장씩 뒤로 넘겨 지며 아팠던 일기가 지워지고 있어 가루 낸 사진이 모여들고 있어 버렸던 미련이 돌아오고 있어 삼켰던 내 눈물이  다시 뱉어지고 뱉었던 그 모진 말은  다시,발라드,262,2014-09-30,가을_새벽,휴식/수면,슬픔
5400360,2284244,925,김동률,그게 나야,동행,난 너에게 모두 주고 싶던 한 사람 너 하나로 이미 충분했던 난 너에게 모두 주지 못한 한 사람 너무 쉽게 놓쳐 버렸던 우리 서로 사랑했던 그 시절엔 뭐가 그리 설레고 또 좋았었는지 세상을 다 가진 양 들떠 있던 내  모습이 너 없이 그려지지가 않는 게 그게  나야 난 너에게 너무 앞서 가던 한 사람 어느샌가 홀로 헤매던 우리 서로 사랑했던 그 시절엔 왜 그렇게 힘들고 또 아팠었는지 세상이 무너질 듯 펑펑 울던 네  모습이 한 번에 그려지지도 않는 게 어느새 너는 정말 괜찮은지 다 지운 채로 사는 건지 우리 서로 사랑했던 그 시절은 왜 내게는 추억인 척,발라드,285,2014-10-01,겨울_새벽,휴식/수면,슬픔
5401273,2284376,750125,노르웨이 숲,취한 밤에 (Feat. 효빈),취한 밤에,Tonight Tonight 내가 왜 이러는지 모르겠어 내가 너를 떠나갔잖아 그래 너를 미워했잖아 Dont Cry Dont Cry 눈물이 흐르는데 생각나 내가 많이 좋아했나봐 그래 너를 사랑했잖아 취한 밤에 니가 생각나 너와나의 뜨거운 날을 기억하니 잊혀지지가 않아 많이 보고싶어 취한 나의 모습을 보니 너무나 한심해 떠난 후에라도 그대와 다시 볼 수 있다면 Goodbye Goodbye 이젠 널 놓아줘야 하는데 니가 잊혀지지가 않아 그래 너를 사랑하니깐 떠나지마 마음이 너를 붙잡고 있어 내가 많이 좋아했나봐 그래 너를 사랑했잖아 취한 날에 니가 생각나 너와나의 뜨거운 밤을 기억하니 잊혀지지가 않아 많이 사랑했어 취한 너의 모습을 보니 너무 안고싶어 떠난 후에라도 그대와 한 잔 할 수 있다면 Will,발라드,198,2014-10-02,여름_점심,운동/훈련중,사랑
5408681,2285311,712452,AKMU (악동뮤지션),시간과 낙엽,시간과 낙엽,맨발로 기억을 거닐다  떨어지는 낙엽에  그간 잊지 못한 사람들을 보낸다  맨발로 기억을 거닐다  붉게 물든 하늘에  그간 함께 못한 사람들을 올린다  시간은 물 흐르듯이 흘러가고  난 추억이란 댐을 놓아  미처 잡지 못한 기억이 있어  오늘도 수평선 너머를 보는 이유  맨발로 기억을 거닐다  날 애싸는 단풍에  모든 걸 내어주고 살포시 기대본다 맨발로 기억을 거닐다 다 익은 가을내에 허기진 맘을 붙잡고 곤히 잠이 든다 가슴의 꽃과 나무 시들어지고 깊게 묻혀 꺼내지 못할 기억 그 곳에 잠들어 버린 그대로가 아름다운 것이 슬프다 슬프다 맨발로 기억을 거닐다 노란 은행나무에 숨은 나의 옛날,발라드,248,2014-10-10,가을_새벽,산책/걷는중,슬픔
5413256,2285785,436981,비스트,12시 30분,TIME,요란한 소릴 내며  깨지는 유리병 우리 모습일까  낮게 깔린 하늘이 금방이라도  부서질 것 같으니까  왜 이제야 왔냐며  날 기다렸다며  내 사랑 반겼던 너는 이제  어쩌다 마주친 모르는 사람보다  차갑게 얼어있다  환한 네 미소도 환한 미소도  따뜻한 네 품도 네 얼굴도  더 이상 볼 수도  만질 수도 없을 것만 같아 두려워  지금 우린 마치  시 분의 시곗바늘처럼  서로 등 돌리고 다른 곳을 보고  모든 걸 버리려고 하잖아  우린 마치  시 분의 시곗바늘처럼  다신 돌아올 수 없는 곳으로  걸어가고 있잖아  우릴,발라드,235,2014-10-20,겨울_새벽,휴식/수면,슬픔
5458267,2290324,205880,규현 (KYUHYUN),광화문에서 (At Gwanghwamun),The 1st Mini Album '광화문에서 (At Gwanghwamun)',넌 어땠는지 아직 여름이 남아 왠지 난 조금 지쳤던 하루 광화문 가로수 은행잎 물들 때 그제야 고갤 들었었나 봐 눈이 부시게 반짝이던 우리 둘은 이미 남이 되었잖아 네 품 안에서 세상이 내 것이었던 철없던 시절은 안녕 오늘 바보처럼 그 자리에 서 있는 거야 비가 내리면 흠뻑 젖으며 오지 않는 너를 기다려 나는 행복했어 그 손 잡고 걷던 기억에 또 뒤돌아 봐 네가 서 있을까 봐 난 모르겠어 세상 살아가는 게 늘 다른 누굴 찾는 일 인지 커피 향 가득한 이 길 찾아오며 그제야 조금 웃었던 나야 처음이었어 그토록 날 떨리게 한 사람은 너 뿐이잖아 누구보다 더 사랑스럽던 네가 왜 내게서,발라드,283,2014-11-13,가을_새벽,산책/걷는중,슬픔
5465008,2291053,100014,토이,세 사람 (With 성시경),Da Capo,많은 사람들 분주한 인사 우리 모두 모인 게 얼마 만인 건지 하얀 드레스 멋있어진 녀석 정말 잘 어울려 오랜 내 친구들 축하해 기억나는지 우리 처음 만난 날 새로운 꿈 시작된 월의 캠퍼스 어쩌면 그때 나는 알았나 봐 너 때문에 웃고 울게 될 나를 스무살 그 시절 우리 여름날의 멜로디 가슴속에 늘 숨 쉬는 풍경 하나 내 친구 처음 소개하던 날 뭔가 달라 보이던 너의 표정 넌 시작이었나 봐 둘만의 비밀이 닮아있는 말투가 친구라는 슬픈 말이 날 멈추게 만들어 말할 수 없는 나의 고백 용길 낼 수 없던 수많은 날 너의 연인은 내 오랜 친구 축복의 노래 꽃잎 흩날리면 눈부신 너의,발라드,286,2014-11-18,봄_새벽,산책/걷는중,기쁨
5465067,2291053,100014,토이,U & I (With Crush & 빈지노),Da Capo,you know 너 땜에 자꾸 난 전화길 못 놔 니가 올린 음식 사진도 네 친구들 댓글에 내 마음 두근 대 내가 생각해도 내가 웃겨 너의 하루가 다 궁금해 난 네가 정말 좋은가 봐 you know 니 SNS 업데이트될 때 내 입가엔 oh no 제일 먼저 내가 좋아요 누르곤 해 뭐 하는 건지 참 내가 생각해도 내가 웃겨 너의 모든 게 다 궁금해 난 네가 정말 좋은가 봐 잠이 오질 않아 니가 숨 쉬는 방은 어떤 모습일까 무슨 꿈 꿀까 나처럼 너도 내 생각하고 있는 건 아닐까 혹시 아닐까 너를 안아 줄래 네게 입 맞출래 내 품에 담을래 you and me,발라드,268,2014-11-18,봄_새벽,운동/훈련중,분노
5474213,2292019,1191,박효신,HAPPY TOGETHER,HAPPY TOGETHER,세상을 몰랐었던  마냥 웃기만 했던  푸른 하늘 닮은 꿈을 가진  키 작은 꼬마가 어느새  담을 넘는다  언덕 위로 좁게 트인  그 작은 길 따라  어디로 가는 걸까  작은 돌에 그만 넘어져도  일어나 다시 그 길 따라 걸어보렴  좀 더디면 어때  어디든 좋아  한 걸음씩  so happy together  너의 손을 잡고서  너와 발을 맞추며 가자  we are dancing together  서두르진 마  조금 익숙한 멜로디를 불러봐  루루루 루루루  너를 위한 멜로디  루루루 루루루  누구도 상상 못 할  내일이 또,발라드,250,2014-11-24,봄_아침,산책/걷는중,슬픔
5482064,2292762,161636,엠씨더맥스 (M.C the MAX),바라보기,미녀의 탄생 OST Part 4,마음이 알고 가 낯선 길인데도 니 숨결이 머문 자리는 너무 그립다 그립다 못해 아프다 누군가를 두 눈에 담았을 뿐인데 눈물이 그댄 내 삶의 이유 입니다 겁 없는 사랑이라서 사랑이 아픔을 앞서 나가서 바라보는 일이 내 전부래도 버릴 수 없는 그대 입니다 어제도 그래 오늘도 반쯤 날 미치게 망가트려놓고 아무리 애써봐도 지워지지 않을 그리움 나를 사랑하지 않아도 거칠 것이 없는 나라서 이 사랑에 모든 걸 내던집니다 끝이 결코 행복하지 않아도 내 가슴이 가는 데로 따라 걷는다 그댄 내가 사는 이유입니다 바라보는 일이 내 전부래도 손 놓지 못할 사랑입니다,발라드,218,2014-11-28,가을_새벽,휴식/수면,슬픔
5493719,2293906,735094,김나영,니 말대로,니 말대로,잘지내란 그 말을  그냥 듣고 있었어  이해해서 그런 게 아니야  애써 눈물 참는데  너를 미워하란 그 말만  자꾸 몇 번이나 되풀이 하는 너  그래 너 나빠 넌 너무도 나빠  이러지 마  내가 너무 초라해 보이잖아  니 말대로 나 니 말대로 널  미워할 수 없는 나란 걸 알잖아  지겹도록 나 지치도록 널  많이 사랑했던 내 맘 모두  보여준 것 뿐야  아직은 말야 니 말대로 나  너를 미워 못해  니가 돌아선 뒤로  참았던 눈물이 터져서  너를 잡을 수 없을 만큼  목이 메여 ,발라드,235,2014-12-09,봄_새벽,운동/훈련중,슬픔
5495296,2294058,792091,정승환,사랑에 빠지고 싶다,K팝 스타 시즌4 '사랑에 빠지고 싶다',운동을 하고 열심히 일하고 주말엔 영화도 챙겨보곤 해 서점에 들러 책 속에 빠져서 낯선 세상에 가슴 설레지 이런 인생 정말 괜찮아 보여 난 너무 잘살고 있어 헌데 왜  너무 외롭다 나 눈물이 난다 내 인생은 이토록 화려한데 고독이 온다 넌 나에게 묻는다 너는 이 순간 진짜 행복 하니 난 대답한다 난 너무 외롭다 내가 존재하는 이유는 뭘까 사랑이 뭘까 난 그게 참 궁금해 사랑하면서 난 또 외롭다 사는 게 뭘까 왜 이렇게 외롭니,발라드,145,2014-12-07,가을_새벽,산책/걷는중,슬픔
5531377,2298233,242868,나비,한강앞에서,REAL STORY,안녕 잘 지내라는 마지막 인사를 전하는 너를 바라보며 한참 동안 바보처럼 울었어 너와 자주 오던 한강 앞에서 이렇게 끝날 줄은 몰랐어 오늘 어쩐지 한강에 오기 싫더라 이상하게 느낌이 안 좋아서 아픈척하고 차라리 나오지 말걸 보고싶어 빨리 왔는데 노을지는 저녁 하늘 때문인 건지 붉어진 눈에 비친 니 얼굴이 더 아파와 예쁘게 보이려 더 신경 쓰고 한 걸음에 널 만나러 왔는데 오늘 어쩐지 한강에 오기 싫더라 이상하게 느낌이 안 좋아서 아픈척하고 차라리 나오지 말걸 보고싶어 빨리 왔는데 다른 사람들 다 웃고 있는데 모두 좋아 보이는데 나만 혼자 눈물나 오늘 어쩐지 한강에 오기 싫더라 이상하게 느낌이 안 좋아서 아픈척하고 차라리 나오지 말걸 보고싶어,발라드,192,2015-01-06,봄_새벽,산책/걷는중,슬픔
5536206,2298684,105623,노을,목소리,보이지 않는 것들,너무 보고 싶어서 가만히 너를 떠올려 보기도 했어 기억 속 네가 흐려진 만큼 잊혀진 거라 믿었어 지워질 거라고 하지만 지날수록 너의 그 모습보다 아련한 향기보다 그리워 단 한 번만 다시 들을 수 없을까 귓가에 맴도는 네 목소리 이렇게 너를 부르면 언젠간 들을 수가 있을까 사랑한 날의 네 목소리 사랑한다는 말이 익숙해질 즈음 그 때 우린 헤어졌어 한동안 너의 따스히 건네던 그 말을 잊은 채 너와 다시 만나고 너를 안고 싶었던 지난 날의 내가 참 미워 단 한 번만 다시 들을 수 없을까 귓가에 맴도는 네 목소리 이렇게 너를 부르면 언젠간 들을 수가 있을까 사랑한 날의 네 목소리 그렇게 떠나가던 날,발라드,261,2015-01-08,가을_새벽,휴식/수면,슬픔
5551234,2300266,792091,정승환,슬픔 속에 그댈 지워야만 해,K팝 스타 시즌4 - 캐스팅 오디션 Part.1,창가에 불어오는 가을바람은 텅 빈  마음을 스쳐 가는데 차가워진 벽에 기대어 멀리 밝아오는  새벽하늘 바라보아요 보고 싶지만 가까이 갈수 없어 이젠 그대 곁을 떠나가야 해 외로웠었던 나의 메마른 그 두 눈에 크고 따뜻한 사랑을 주었던 그대 곁을 이제 떠나는 것을  후회할지도 모르지만 그댈 사랑하기 때문이야 그대만을 사랑하는 걸  잊을 수는 없지만 슬픔 속에 그댈 지워야만 해 그대 곁을 이제 떠나는 것을 그대 곁을 이제 떠나는 것을  후회할지도 모르지만 그댈 사랑하기 때문이야 그대만을 사랑하는걸  잊을 수는 없지만 잊을 수는 없지만  슬픔 속에 그댈 지워야만 해 사랑하는 그대여 안녕,발라드,190,2015-01-18,가을_새벽,차량/운전중,슬픔
5555751,2300803,236815,다비치,또 운다 또,DAVICHI HUG,또 운다 또 울지 말라니까 내 말 좀 들어라 터진 눈물아 약한 마음아 상처 난 가슴아 나는 정말 울기 싫단다 또 운다 또 울지 말라니까 제발 그 앞에서 울지마 무슨 말만 하면 울잖아  헤어지잔 말 한 마디에 아무 말도 못하면서 사랑한다고 사랑한다고 말도 못하면서 뚝 그만 울라니까 가 제발 가 오지 말라니까 내 말 좀 들어라 나쁜 이별아 하고 싶은 말 얼마나 많은데 나는 아직 사랑하는데 가 제발 가 그는 남겨두고 제발 그 앞에서 울지마 무슨 말만 하면 울잖아 헤어지잔 말 한 마디에 아무 말도 못하면서 사랑한다고 사랑한다고 말도 못하면서 뚝 그만 울라니까 눈물 뒤로 사랑이 숨어서 그가 날,발라드,201,2015-01-21,가을_새벽,휴식/수면,사랑
5629186,2309363,28801,허각,사월의 눈,사월의 눈,어느새 그 차가웠던 긴 겨울에 하얀 눈도 스르륵 봄바람에 다 녹아내려요 다시 또 누군가를 사랑할 수 있으려나요 눈부신 따스한 봄날엔 그토록 욕해대고 할퀴어대던 두 사람이 나였는지 그녀였는지 조차 잊어버린 듯 그 겨울 그 겨울이 그때 우리가 참 그리워 미운데 미운데 그리워 큰맘 먹고 살짝 열어본 내 창가에 눈부신 봄날 햇살 아래로 차디찬 눈이 내려요 작은 내 방에 내 텅 빈 가슴에 그 아팠던 상처가 또 다시 덧나려는 듯 이른 봄날에 눈이 내려요 주르륵 흘러내린 내 눈물마저도 차네요 내게도 봄날이 올까요 누군갈 또 다시 사랑하고 싶어서 미친 듯 거리를 걸어봐도 차디찬 눈이 내려요 내 두 눈가에 이 못난 가슴에 그 아팠던,발라드,239,2015-03-17,겨울_새벽,휴식/수면,사랑
5639931,2310810,175139,케이윌,꽃이 핀다,[RE:],바람꽃이 날리고  해가 길어져 가고 이젠 이 길을   밤새 걸어도 걸어도  손 끝이 시리지가 않아  무거운 너의 이름이  바람에 날아오르다 또 다시 내 발끝에 떨궈져  아직 너도 날 떠나지 않는 걸까  아주 가끔은 널 잊고   하루가 지나고  아주 가끔은 너 아닌   다른 사람을 꿈꿔도  나의 마음에선   너란 꽃이 자꾸 핀다  가슴에 no no no no  아픈 니가 핀다 아무도 모를 만큼만  그리워하며 살았어 소리 내 울었다면 난 지금  너를 조금 더 잊을 수 있었을까  아주 가끔은 널 잊고 ,발라드,234,2015-03-25,봄_새벽,산책/걷는중,슬픔
