music_index,album_index,singer_index,singer,song,album,lyrics,genre,music_titme,album_released,time,activity,emotion
3633511,2044412,105623,노을,살기 위해서,빠담빠담 OST Part.1,내가 이렇게도 가슴이 뛰는 건 그대가 내 마음에 다녀 갔었나 봐 우리사랑은 또 스쳐가지만 세상에서 가장 그리운 사람 내가 어느새 그대 이름을 불러 원합니다 내가 살기 위해서 그 사랑이 아파도 기다릴게 여기서 사랑이란 멀리 있어도 언젠간 만날 테니까 니가 없으면 죽을 것 같아서 살기 위해서 왜 이유 없이 눈물이 났는지 그렇게 가슴 아파야 했는지 지금 달려가 꼭 말해주고 싶어 원합니다 내가 살기 위해서 그 사랑이 아파도 기다릴게 여기서 사랑이란 멀리 있어도 언젠간 만날 테니까 니가 없으면 죽을 것 같아서 널 사랑해서 두 번 다신 못 보게 될 까봐 연기처럼 니가 사라질까봐 난 두려워 원합니다 내가 살기 위해서 날 살게 해준,발라드,235,2011-12-05,가을_새벽,산책/걷는중,슬픔
3681993,2067506,573812,효린,널 사랑하겠어,사랑을 보다 2 OST,내 뜨거운 입술이 너의 부드러운 입술에 닿길 원해 내 사랑이 너의 가슴에 전해지도록 아직도 나의 마음을  모르고 있었다면은 이 세상 그 누구보다 널 사랑하겠어 널 사랑하겠어  언제까지나 널 사랑하겠어 지금 이 순간처럼  이 세상 그 누구보다 널 사랑하겠어 어려운 얘기로 너의 호기심을  자극할 수도 있어 그 흔한 유희로 이 밤을  보낼 수도 있어 하지만 나의 마음을  이제는 알아줬으면 해 이 세상 그 누구보다  널 사랑하겠어 널 사랑하겠어 언제까지나 널 사랑하겠어 지금 이 순간처럼  이 세상 그 누구보다 널 사랑하겠어 널 사랑하겠어 널 사랑하겠어 언제까지나 널 사랑하겠어 지금 이 순간처럼  이 세상,발라드,210,2012-01-19,봄_새벽,차량/운전중,슬픔
3701333,2077426,629831,에일리(AILEE),Heaven,Heaven,니가 있는 곳에 나도 함께 할게 니가 가는 곳에 나도 함께 갈게 널 위해서 매일 웃고 널 위해서 기도하고 니 생각에 잠들고 널 부르며 눈을 떠 내 옆에서 지켜주고 내 옆에서 감싸주는 넌 나의 천국인걸 Youre my only one way 오직 너를 원해 내가 니 곁에 있음에 감사해 Youre the only one babe 힘든 세상 속에 사랑을 알게 해준 너 하나로 나는 행복해 Heaven Heaven Heaven Heaven Heaven Heaven Heaven Heaven Heaven Heaven 우리 함께라면 we will never cry never never cry Heaven Heaven Heaven Heaven Heaven Heaven Heaven Heaven Heaven Heaven 영원히 둘이서 never gonna be alone 니 품에서,발라드,211,2012-02-09,가을_아침,차량/운전중,기쁨
3706380,2079769,175139,케이윌,니가 필요해 (I Need You),니가 필요해 (I Need You),잘 있었냐는 너의 인사말에 참았던 가슴은 또 뜨거워지고 정말로 내가 알던 너인지 한참을 되묻고 일 년 만인 목소리에 반가웠고 보고 싶었다는 말에 자꾸 눈물만 내려와 너도 나만큼 아팠던 걸까 니가 필요해 니가 필요해 일 년이 가도 십 년이 가도 나는 똑같아 단 하루도 잊지 못한 사람 난 너여야만 해 내 사랑이 너 인데 너 없이는 안돼 니가 필요해 길을 걷다 보고 다시 보고 내 손을 꼭 잡은 니 손을 또 보고 괜히 또 놓고 다시 잡고 바보같이 웃고 둘이라서 행복했던 소박했던 함께라 당연했던 그런 것들만 생각나 그때 우리는 왜 몰랐던 걸까 니가 필요해 니가 필요해 일 년이 가도 십 년이,발라드,218,2012-02-14,가을_새벽,휴식/수면,슬픔
3707405,2080250,8530,린,시간을 거슬러,해를 품은 달 OST,구름에 빛은 흐려지고 창가에 요란히 내리는 빗물소리 만큼 시린 기억들이 내 마음 붙잡고 있는데 갈수록 짙어져간 그리움에 잠겨 시간을 거슬러 갈순 없나요 그 때처럼만 그대 날 안아주면 괜찮을텐데 이젠 젖어든 빗길을 따라가 함께한 추억을 돌아봐 흐려진 빗물에 떠오른 그대가 내 눈물 속에서 차올라와 갈수록 짙어져간 그리움에 잠겨 시간을 거슬러 갈순 없나요 그 때처럼만 그대 날 안아주면 괜찮을텐데  이젠 흩어져가 나와 있어주던 그 시간도 그 모습도 다시 그 때처럼만 그대를 안아서 시간을 거슬러 갈수 없나요 한번이라도 마지막일지라도 괜찮을텐데,발라드,212,2012-02-15,가을_새벽,휴식/수면,슬픔
3710333,2081526,1010,이승철,잊었니,신들의 만찬 OST Part.1,잊었니 날 잊어버렸니 그 수많은 추억들은  잊어 버렸니 가슴은 널 향해 팔 벌려 오늘도 간신히 버티고 있는데 추억이 점점  빛 바래 가면 너와 거닐던 길에 우두커니 서  지우고 또 지우려 해도 니숨결 목소리가 귓가에 들려 잊었니 날 잊어 버렸니  아직 난 널 기다리잖아 사랑이 또 울고 있잖아   가슴엔 늘 눈물이 고여 지워도 자꾸 지우려 해도 그대 얼굴이 자꾸 떠오르네요 잊었니 날 잊어버렸니 수많은 추억들은  잊어 버렸니 가슴은 널 향해 팔 벌려 오늘도 간신히 버티고 있는데 잊었니 날 잊어 버렸니  아직난 널 기다리잖아 사랑이 또 울고 있잖아   가슴엔 늘 눈물이 고여,발라드,194,2012-02-17,가을_새벽,휴식/수면,사랑
3714473,2083726,28772,존박,Falling,Knock,하얗게 번지는 머릿속에다  그대를 새겨놓고 저 멀리 날아가  모든 게 보이는 두 눈을 감고서  시간을 되돌려서  그 때로 돌아가고 싶어  Falling 이대로 falling for you  날 잡아줄 수 없어도  Falling 또 다시 falling for you  날 감싸줄 수 없나요  좋았던 나날도 너무 아팠던 날도  이제 돌이켜보면 그저 그랬었나요  아니라 말해요 멍든 가슴도  멍해진 내 마음도  다시 느낄 수만 있다면 Falling 이대로 falling for you 날 잡아줄 수 없어도 Falling 또 다시 falling for you 날 감싸줄 수 없나요 까맣게 번지는 하늘 위에서 한없이 추락하는 날 보고만 있네요,발라드,222,2012-02-22,가을_아침,산책/걷는중,슬픔
3729818,2090746,175155,먼데이 키즈 (Monday Kiz),오늘 같은 밤이면,Nostalgia,얼마나 그댈 그리워 하는지 몰라 더 이상 외로움 난 견딜수 없고  언제나 어두운 밤이 찾아올때면 살며시 그대 이름 부르곤 했어 눈감으면 그대 곁에 있는것 같아 하지만 그대 숨결 느낄수 없고 무겁게 나를 누르는 이 빈 공간은 끝없는 방황으로 나를 이끄네 기나긴 기다림 속에 지쳐도 그대 외롭다고 눈물 짓지마 언젠가 그대의 두손을 잡고서 함께 걸어 갈테야 오늘 같은 밤이면 그대를 나의 품에 가득 안고서  멈춰진 시간 속에 그대와 영원토록 머물고 싶어 눈 감으면 그대 곁에 있는것 같아 하지만 그대 숨결 느낄수 없고 무겁게 나를 누르는 이 빈 공간은 끝없는 방황으로 나를 이끄네 기나긴 기다림 속에 지쳐도 그대 외롭다고 눈물,발라드,277,2012-03-08,겨울_아침,휴식/수면,슬픔
3731994,2092046,253866,2AM,너도 나처럼,F.Scott Fitzgerald's Way Of Love,하루종일 니 생각만 하다가  한 가닥 눈물이 멋대로   주르륵 흐른다  걸음걸음 니 모습이 밟혀서  일을 하다가도 나도   모르게 또 흐른다  우후후후후 노래를 불러도  우후후후후 거리를 걸어도  우후후후후 온통 니 생각 뿐인데  너도 나처럼 이렇게 아픈지  너도 나처럼 눈물 나는지  너도 하루종일 이렇게 추억에   사는지 꼭 나처럼  억지라도 웃을 일 참 많은데  태엽 인형처럼 주어진 일처럼 웃는다  우후후후후 TV를 보아도  우후후후후 친구를 만나도  우후후후후 온통 니 생각 뿐인데  너도 나처럼 이렇게 아픈지  너도 나처럼 눈물 나는지  너도 하루종일,발라드,228,2012-03-12,가을_새벽,휴식/수면,슬픔
3733443,2092611,8433,김수현,그대 한 사람,해를 품은 달 OST Part.6,손을 뻗으면 닿을 수 있게 그대 내게 멀리 가지 마세요 누굴 찾고 있나요 그대만 기다리는 사람 여기에 여기 있는데  내가 지켜줄 사람 나만 바라볼 사람 저 달을 보며 매일 기도해요 날 사랑하는 오직 한 사람  사랑해요 그대 한 사람 사랑해요 그대 한 사람 내가 미칠듯이 사랑했던 단 한 사람  하늘에서 비가 내리고 달이 뜨면 그대 올까요 내 모든 걸 다 가져 간 한 사람  그댈 찾을 때까지 계속 걸어와줘요 내가 그대만의 빛이 될게요  내가 지켜줄 사람 나만 바라볼 사람 저 달을 보며 매일 기도해요 날 사랑하는 오직 한 사람  사랑해요 그대 한 사람 사랑해요,발라드,233,2012-03-13,가을_새벽,휴식/수면,슬픔
3736176,2093727,8530,린,곰인형 (Feat. 해금),LoveFiction,함께 본 영화표를 태우고 니가 사준 곰 인형을 패도 엉엉 울어 봐도 후련하질 못해 함께 산 핸드폰을 버리고 니가 사준 백일반질 빼도 준건 다 버려도 널 잊지를 못해 아무런 생각도 나지 않고 아무도 만나고 싶지 않아 사랑이 이런 건지 몰랐어요 아무런 얘기도 하기 싫고 아무런 전화도 받기 싫어 이렇게 힘든 건지 몰랐어요 난 백년을 사랑한 게 아닌데 백일을 겨우 넘긴 너인데 숟가락만 들어도  자꾸 니 생각에 눈물이 나 세수하다 모르게  자꾸 니 생각에 눈물이 나 자꾸 니 생각이 나  울고 울어도 눈물이 나 새빨간 하트를 지우고  저장된 일번을 지워도 다른 번호로 바꿔 봐도  안돼 안돼,발라드,207,2012-03-16,가을_새벽,산책/걷는중,슬픔
3758104,2105027,28801,허각,나를 사랑했던 사람아,LACRIMOSO,잘 지내고 있는건지 무슨 일 없는지 지겹던 너의 잔소리가 너무 그리워서 그렇게 나 하나밖에 모르던 너인데 나 없이도 괜찮은지 하루에 수백번씩 나 후회를 하고 네가 없다는걸 느끼며  나 매일을 살아 널 위해 내가 떠나야 하는게 맞지만 난 널 잊고 살 순 없는가봐 나를 사랑했던 사람아  이젠 곁에 없지만 아직 잊지 못하고 너를 잊지 못하고 그저 한번이라도 다시 볼 수 있다면 볼 수만 있다면  다시 널 볼 수 있다면 너무나도 아프고 잊을 수가 없어 하루에도 몇번씩 하던  너의 그 투정이 웃으며 내 품에 안겨서  날 보던 모습이 헤어지던 날 너의 두 눈이 나를 사랑했던 사람아 ,발라드,239,2012-04-03,가을_새벽,휴식/수면,슬픔
3759927,2106226,3854,양파,사랑은 다 그런거래요,Together,그대 울지 말아요   슬퍼하지 말아요   사랑은 다 그런 거래요  마음 주면 줄수록 가슴 아픈   거래요 아파야 사랑인거죠  그만 눈물 거둬요   그대 이젠 웃어요   사랑이 또 그댈 울려도  진정 사랑했다면 진정 후회 없다면   그것으로 된 거죠  그대 울지 말아요   슬퍼하지 말아요   사랑은 다 그런 거래요  마음 주면 줄수록 가슴 아픈   거래요 아파야 사랑인거죠  눈물이 흐르는건 사랑했단 뜻이죠  애써 지우려해도 지울수가 없네요  그립고 그리울 땐 그 이름을 불러  너무나 외로울 땐 두눈을 또 감어 ,발라드,235,2012-04-05,가을_새벽,산책/걷는중,슬픔
3772625,2112227,105623,노을,떠나간다,떠나간다,나는 괜찮아  내가 널 잊어야 행복할 수 있다면  이미 떠나버린 니맘을  붙잡을 수는 없다는 게 느껴져서 언젠가 다시 웃으며 볼 수 있게 웃으며 보내줄게 어쩌다가 가끔 취해 전화를 걸어 울면서 너를 찾겠지만 떠나간다 떠나간다 날 버리고 떠나간다 내가 사랑했던 추억들도 다 가지고 떠나간다 울어본다 울어본다 가지 말라고 울어본다 너무 사랑했던 널 결국 나는 널 보내준다 니가 간다 좋았던 날들 이젠 내게 다시 올진 모르겠지만 그만해줘야지 남은 사랑은 모두 그 사람에게 받겠지 너 없인 아직 자신이 없어서 마지막 힘을 다해서 떠나려는 너를 밀어내는 너를 눈물로 잡아보지만 떠나간다 떠나간다 날 버리고 떠나간다 내가 사랑했던 추억들도 다 가지고 떠나간다 울어본다,발라드,239,2012-04-19,가을_새벽,휴식/수면,슬픔
3820647,2124713,673198,JUNIEL(서아),illa illa (일라 일라),My First June,따스하게 부는 향기로운 바람 내 두 볼에 스치면 난 사랑했던 그대 얼굴이 떠오르죠 oh 길가에 숨어선 이름도 모르는 들꽃이 필 때쯤엔 기억 저 편에 감춰 둔 그대가 떠오르죠 My baby illa illa illa baby illa illa illa baby illa illa illa Never forget love 첫사랑은 아름다워서 첫사랑은 꽃이랍니다 봄이 오면 활짝 피는 오 눈이 부신 꽃처럼 첫사랑은 어린애처럼 첫사랑은 서투릅니다 사랑을 아낌없이 주고 갖질 못하니까 illa illa illa illa illa illa illa illa illa 나의사랑 good bye  까만 밤하늘에 그려있는 별이 그대 추억 불러오면 오랜 일기장 속에서 그댈 꺼내봅니다 My baby illa illa illa baby illa illa illa baby,발라드,216,2012-06-07,겨울_저녁,산책/걷는중,슬픔
3822632,2126378,429480,이현,가슴이 시린 게,신사의 품격 OST Part 3,날 돌아봐줘요 곁에 있어요 고개를 돌려봐요  딴 곳만 보네요 늘 그랬듯이 먼 곳만 보네요  그 사람을 사랑하는 그댈 보면서 살아 가는 게 내 사랑인걸 아나요 가슴이 시린 게 바라만 보는 게 그대가 없는 게 습관처럼 익숙해져 난 아픈 줄도 모르네요 눈물이 나는데 말도 못하는데 웃어야 하는데 습관처럼 그대 앞에서 바보처럼 사랑해서 눈물이 나는데 단 한번이라도 그대 힘들면 나를 봐줄래요 울지 마요 울지 마요 그댈 보면서 기도해봐요 나의 바램을 아나요 가슴이 시린 게 바라만 보는 게 그대가 없는 게 습관처럼 익숙해져 난 아픈 줄도 모르네요 눈물이 나는데 말도 못하는데 웃어야 하는데 습관처럼 그대 앞에선 바보처럼 사랑해서 이렇게 웃는데 가슴이,발라드,271,2012-06-17,겨울_새벽,휴식/수면,슬픔
3859894,2138075,2165,보아 (BoA),Only One,Only One,멀어져만 가는 그대  Youre the only one  내가 사랑했던 것만큼  Youre the only one 아프고 아프지만  바보 같지만 Good bye  다시 널 못 본다 해도  Youre the only one Only One 어색하게 마주앉아  사소한 얘기로 안부를 묻고 가끔 대화가 끊기는 순간에는  차가운 정적 우릴 얼게 만들어 지금 이 자리에서 우리는 남이  되겠지 어느 누군가는  눈물 흘리며 남겠지만 상처주지 않으려고 자꾸 애를  써가면서 눈치 보는 니 모습 싫어  So Ill let you go 내사랑 이제는 안녕  Youre the only one  Youre the only one 이별하는 이순간에도 ,발라드,219,2012-07-22,가을_저녁,산책/걷는중,슬픔
3864961,2138690,510537,신용재 (2F),가수가 된 이유,24,인터넷에 나를 쳐보면  이제 내 노래가 나와 내가 왜 굳이 이렇게 가수가 된지 넌 알까 유명하고팠던 이유는 오직 단 하나뿐이니까 니가 날 보고 날 알아듣고 내 생각하라고 TV에 나와 노래해 혹시 니가 볼까봐 날 들으면 날 본다면 날 찾아줄까봐 기를 쓰고 노래해 그 옛날의 널 위해 그때 다 하지 못했던 내 맘을 담아서 이렇게 노래해 못해부터 살다가까지 니가 없던 건 없으니까 솔직히 터놓고 말해 모두 너와 내 얘기니까 내 노랠 듣고 내가 울고 내가 슬퍼하고 혼자 미치는 나의 이유를 넌 알 것 같은데 TV에 나와 노래해 혹시 니가 볼까봐 날 들으면 날 본다면 날 찾아줄까봐 기를 쓰고 노래해 그,발라드,260,2012-07-27,봄_새벽,휴식/수면,분노
3866006,2138790,236815,다비치,남자도 우나요,THE S Part.1,여자는 그래요 헤어졌다고 쉽게 다른 사람을  사랑하지 못해요 몸은 떨어져 볼 수  없다 해도 마음이 놓질 못해요  여자는 약해요  독한 척해도 쉽게 추억을 잊고  살아가지 못해요 아직 그 사람  전화번호조차 지우지 못한 바보니까요 그 목소리 너무  듣고 싶어서 그 얼굴 보고 싶어서 눈이 붓도록 매일  펑펑 울어요 남자도 우나요 이별에 아파하긴 하나요 미칠 듯 그리워 속으로  흐느끼긴 하나요 나 혼자 아프고 나만  슬픈 것 같아 묻고 싶어요 그댄  괜찮은가요 추억을 다 헤아릴 수  없어서 미련이 흘러 넘쳐서 아직 사랑이 남아  혼자 울어요 남자도 우나요 이별에 아파하긴 하나요,발라드,233,2012-07-30,겨울_새벽,운동/훈련중,안정
3884575,2145068,28801,허각,I Need You,I Need You,I Need You  가만히 눈을 감고 있어도  자꾸 생각나죠 그댄 내게 마치 뜬 구름 같은걸 사랑이란 말로 아직  부족한가요  내 맘이 위험한가요 그댄 내게 전부가 됐네요 같은 길을 걷고 같은 꿈을 꾸고 나 혼자만 몰래  상상을 하고 oh 그대 곁에 잠든  마치 연인 같은 그대와 내 모습  baby I love you I need you  수줍은 나의 고백 오랫동안 몰래 숨겨왔던 노래 I need you  참 순진했던 고백 너도 좋다면  가까이 다가와 I need you 울리지도 않는 전화기를  자꾸 보게되죠 그댄 내게 기분 좋은  기대 같은걸 하루만 더 기다리면,발라드,223,2012-08-21,가을_저녁,차량/운전중,사랑
3890826,2148020,436700,서인국,All For You,응답하라 1997 Love Story Part 1,all for you   벌써 며칠째 전화도 없는 너  얼마 후면 나의 생일이란 걸 아는지  눈치도 없이 시간은 자꾸만 흘러가고  난 미움보다 걱정스런 맘에  무작정 찾아간 너의 골목 어귀에서  생각지 못한 웃으며   반기는 너를 봤어  사실은 말야 나 많이 고민했어  네게 아무것도 해줄 수 없는걸  아주 많이 모자라도 가진 것 없어도  이런 나라도 받아 줄래  너를 위해서 너만을 위해서  난 세상 모든 걸   다 안겨 주지는 못하지만  난 너에게만 이제 약속할게  오직 너를 위한 내가 될게  Is only for you ,발라드,248,2012-08-28,겨울_새벽,차량/운전중,안정
3893169,2148411,570731,정키,홀로 (Feat. 김나영),Break Up,아침에 눈을 떴을 때 텅 빈 방안에 나 홀로  니 빈자리 거닐면서 많은 생각들에 잠겨 지워질 수 없는 기억  돌이킬 수 없는 우리  헤어날 수 없는 나와  멀어져만 가는 너를 바라봐 누군가 한 말 처럼 언젠가 만날 거라 그렇게 우린 헤어진 거야 집에 오는 길을 홀로 텅 빈 방 침대에 홀로 너와의 기억에 홀로  나 홀로 무뎌질 가슴 안고 추억 속에 살아 홀로 방안에서 깨면 홀로 늘 있던 니가 없어 익숙해지겠지  나 홀로 그 때를 기억하니 너와 내가 우리란 말로 함께 할 수 있었던 그 날의 사랑들을 잠시 맞잡았던 두 손  차마 놀,발라드,268,2012-08-31,가을_새벽,휴식/수면,슬픔
3897152,2149100,420527,어반자카파,니가 싫어,니가 싫어,나는 너에게  사랑을 구걸하지 않았어 진심을 원했어 마지막으로 널 봤던 날도 널 원하지 않았어 진심을 원했어 상처받은 내 마음과 더럽혀진 그때 추억 날 바라보던 니 표정 다 너무 싫어 난 니가 싫어 불안했던 우리 모습 지켜내려던 내 모습 다 너무 후회가 돼 잘 몰랐던 나 난 니가 싫어 나는 너에게  사랑을 구걸하지 않았어 진심을 원했어 마지막으로 우리 만난 날도 넌 진심이 없었어 진심을 원했어 상처받은 내 마음과 더럽혀진 그때 추억 날 바라보던 니 표정 다 너무 싫어 난 니가 싫어 불안했던 우리 모습 지켜내려던 내 모습 다 너무 후회가 돼 굳게 닫힌 나의 맘과 돌이킬 수 없는 우리,발라드,231,2012-09-05,가을_새벽,산책/걷는중,사랑
3897933,2149209,925,김동률,다시 사랑한다 말할까,기억속의 멜로디,마치 어제 만난 것처럼  잘있었냔 인사가 무색할 만큼  괜한 우려였는지  서먹한 내가 되려 어색했을까 어제 나의 전활 받고서  밤새 한숨도 못 자 엉망이라며  수줍게 웃는 얼굴   어쩌면 이렇게도 그대로일까 그땐 우리 너무 어렸었다며  지난 얘기들로 웃음 짓다가 아직 혼자라는 너의 그 말에  불쑥 나도 몰래 가슴이 시려  다시 사랑한다 말할까  조금 멀리 돌아왔지만   기다려왔다고   널 기다리는 게 나에게 제일   쉬운 일이라  시간이 가는 줄 몰랐다고  다시 사랑한다 말할까   여전히 난 부족하지만   받아주겠냐고  널 사랑하는 게 내,발라드,288,2012-09-05,겨울_새벽,산책/걷는중,슬픔
3905489,2150236,28801,허각,아프다,아프다,아프다 니가 떠나서 아프다 하루종일 울어도 또 아프다 이렇게 아픈데도 정말로 아파도 바보처럼 오늘도 웃는다 보고 싶지만 참는다 니가 행복하길 난 바래본다 나는 너무 아파도 정말 난 아파도 너는 아프지 않길 바란다 너 정말 너를 사랑했는데 점점 아파와서 그게 겁이 나서 힘들지만 난 너를 보낸다 바라보아도 날 안 본다 불러보아도 대답 없다 니가 너무 미워도 정말로 미워도 너는 아프지 않길 바란다 너 정말 너를 사랑했는데 점점 아파와서 그게 겁이 나서 힘들지만 난 너를 보낸다 너 정말 너를 사랑했는데 점점 아파와서 자꾸만 겁이 나서 힘들지만 난 너를 보낸다 힘들지만 난 너를 보낸다,발라드,201,2012-09-14,겨울_저녁,산책/걷는중,분노
3907137,2150523,655051,벤,오늘은 가지마,오늘은 가지마,잠깐 다시 앉아줄래 잠깐 내 얘기 좀 할게 잠깐 내 얼굴 좀 봐줄래  오늘이 가면 다시 안 볼거잖아 오늘은 가지마 오늘만 가지마 오늘만 더 옆에 있어주면 나 잊을 수 있어 오늘은 가지마  제발 떠나지마 오늘만 더 옆에 있어주면 나 노력해볼게 그만 다 쳐다보잖아 그만 좀 그만 울려 날 제발 내일 얘기하자  내게 생각할 시간 좀 달란말야 오늘은 가지마 오늘만 가지마 오늘만 더 옆에 있어주면 나 잊을 수 있어 오늘은 가지마 제발 떠나지마 오늘만 더 옆에 있어주면 나 노력해볼게 내가 잘못 들은 줄만 알았어 아무렇지 않은 척 해도 근데 왜 자꾸 눈물이 나는 걸까 오늘은 가지마 오늘만 가지마,발라드,241,2012-09-18,겨울_새벽,산책/걷는중,슬픔
3922071,2152296,175139,케이윌,이러지마 제발 (Please Don't...),The 3rd Album Part.1,나란히 앉은 자동차 속에선  음악도 흐르지 않아 늘 잡고 있던 니 왼손으로  너 입술만 뜯고 있어 니가 할 말 알아  그 말만은 말아 Dont know why  Dont know why  일분 일초 더 끌고 싶은데 텅 빈 길 나를 재촉해 빙빙 돌아온 너의 집 앞이  나 익숙해 눈물이 나와 하루가 멀게 찾아온  여기서 길을 내가 잃은 것 같아 이러지마 제발 떠나지마 제발 Dont know why  Dont know why  비도 안 오는 유리창 너머  뿌옇게 멀어지는 너 말처럼 쉽진 않은 널  보내야 한다는 일 돌아서서 날 버리고 가는  널 보지,발라드,213,2012-10-11,겨울_점심,휴식/수면,안정
3928194,2153066,39256,J.Lee,말리꽃 (원곡가수 이승철),'나는 가수다 2' 10월 B조 경연,얼마나 더 견뎌야 하는지 짙은 어둠을 헤매고 있어 내가 바란 꿈이라는 것은 없는 걸까 이렇게 난 쓰러진 채로 끝나는 건 아닐까 항상 두려웠지만 지금 내가 가야할 세상 속에 네가 있기에 지쳐 쓰러지며 되돌아가는 내 삶이 초라해 보인데도 죽어진 네 모습과 함께 한다면 이제 갈 수 있어 소중하게 남긴 너의 꿈들을 껴안아 네게 가져가려해 어두운 세상 속에 숨 쉴 날들이 이제 잊혀지도록 지쳐 쓰러지며 되돌아가는 내 삶이 초라해 보인데도 죽어진 네 모습과 함께 한다면 이제 갈 수 있어 소중하게 남긴 너의 꿈들을 껴안아 네게 가져가려해 어두운 세상 속에 숨 쉴 날들이 이제 잊혀지도록 이제 잊혀지도록,발라드,254,2012-10-14,여름_새벽,휴식/수면,안정
3936237,2157826,699632,로이킴,휘파람,슈퍼스타 K4 Top 12 Part.2,그대 떠난 여기 노을진  산마루턱엔 아직도 그대  향기가 남아서 이렇게 서있소  나를 두고 가면 얼마나 멀리  가려고 그렇게 가고 싶어서  나를 졸랐나 그대여 나의 어린애 그대는  휘파람 휘이히 불며 떠나가  버렸네 그대여 나의 장미여 사랑하는 그대 내곁을  떠나갈적엔 그래도 섭섭했었나  나를 보며 눈물흘리다 두손잡고 고개 끄덕여 달라  하기에 그렇게 하기 싫어서  나도 울었네 그대여 나의 어린애 그대는  휘파람 휘이히 불며  떠나가 버렸네  그대여 나의 장미여 그대여 나의 어린애 그대는  휘파람 휘이히 불며  떠나가 버렸네  그대여 그대여 그대여 그대여 나의 장미여,발라드,207,2012-10-22,가을_새벽,산책/걷는중,슬픔
