music_index,album_index,singer_index,singer,song,album,lyrics,genre,music_titme,album_released,time,activity,emotion
30099927,10016012,41499,박원,노력,01월 24일,널 만날 수 있는 날  친굴 만났고 끊이지 않던 대화가  이젠 끊기고 널 바라보다가  다른 사람을 겹쳐봤어 누군가 내 안에  들어온 것도 아닌데 사랑한단 말은  점점 미안하고 억지로 한 것뿐인데  넌 좋아하고 너에게만 나는  아주 바쁜 사람 내 연락을 기다리다가  또 잠들겠지 나도 노력해봤어  우리의 이 사랑을 안되는 꿈을 붙잡고  애쓰는 사람처럼 사랑을 노력한다는 게  말이 되니 서로가 다른 건  특별하다고 같은 건 운명이라  했던 것들이  지겨워져 넌 오늘보다 내일 날  더 사랑한대 난 내일보다 오늘 더  사랑할 텐데 나도 노력해봤어  우리의 이,발라드,263,2016-11-17,겨울_새벽,휴식/수면,열정적
30120986,10018979,792091,정승환,이 바보야,목소리,세상이 멈춘 것 같았어 우연히 널 거리에서 마주쳤을 때 가끔 들리는 너의 안부에도 난 꼭 참았는데 이 바보야 너 땜에 아프잖아 왜 또 옷은 춥게 얇게 입었어 나를 피하는 눈빛이 야윈 너의 얼굴이 그런 니가 미워서 나는 또 밤새 취해 간다 어디부터 잘못된 걸까 천천히 너에게 맞춰 기다렸다면 내가 가진 현실은 초라했고 마음만 커져가고 나 땜에 힘들다고 했잖아 행복해지고 싶다 그랬잖아 어떻게 널 보냈는데 이 바보야 너 땜에 아프잖아 왜 또 옷은 춥게 얇게 입었어 내 전부였던 눈빛이 사랑했던 얼굴이 여전히 반가워서 눈물이 흘러 어렸어서 서운해서 소중해서 불안해서 다 망쳐버린 걸 알아 다 미안해 이 바보야 얼마나 사랑했는데 어떻게 헤어졌는데,발라드,239,2016-11-29,가을_새벽,산책/걷는중,분노
30120987,10018979,792091,정승환,그 겨울,목소리,긴 한숨 속엔 하얀 입김 유난히 시린 이 거리 사랑으로 빛나던 계절은 지나고 얼어 붙은 내 시간 꽃잎이 흩날리던 봄날의 미소 너 여름비 우산 아래 우리 널 데려다 주던 마지막 가을밤 그리고 어느새 겨울 겨울 너 없이 사는 게 왜 이렇게 힘드니 너를 잊는다는 게 왜 난 안되니 추억이 너무 많아 보내지 못하나 봐 아직 내 세상엔 니가 너무 많아 넌 나의 하루야 봄 여름 가을 그리고 봄 난 너의 기억 속에만 살아 너가 없는 하루 남겨진 시간들 이젠 아무 의미 없어 없어 너 없이 사는 게 왜 이렇게 힘드니 너를 잊는다는 게 왜 난 안되니 추억이 너무 많아 놓질,발라드,238,2016-11-29,겨울_새벽,산책/걷는중,슬픔
30132687,10020654,672857,찬열 (CHANYEOL),Stay With Me,도깨비 OST Part.1,나의 두 눈을 감으면  떠오르는 그 눈동자  자꾸 가슴이 시려서  잊혀지길 바랬어  꿈이라면 이제 깨어났으면 제발  정말 네가 나의 운명인 걸까  넌 Falling You  운명처럼 너를 Falling  또 나를 부르네 Calling  헤어 나올 수 없어 제발 Hold Me  내 인연의 끈이 넌지  기다린 네가 맞는지  가슴이 먼저 왜 내려앉는지  Stay With Me   내 마음속 깊은 곳에 네가 사는지   Stay With Me   내 안에 숨겨왔던 진실   나의 두 눈을 감으면  떠오르는 그 눈동자  자꾸 가슴이 시려서  잊혀지길,발라드,193,2016-12-03,겨울_아침,차량/운전중,슬픔
30169383,10025804,757273,샘김 (Sam Kim),Who Are You,도깨비 OST Part.6,where I am who I am 감옥 같은 이 쓸쓸함 많은 사람들이 지나갔지만 모두 나를  지나가기만 했던 이 곳 where I am who are you who are you 감출 수 없는 기쁨 미친 듯 세상을 뒤집어 찾던 꿈에서조차  움켜쥐고 있던 그대 where are you 내가 꼭 찾아낼게 내가 널 알아볼게 니가 있는 곳 어디든 모습이 어떻든 꼭 알아볼게 내가 꼭 기억할게 내가 널 바라볼게 니가 없는 곳에서도 수많은 해가 져도 잊지 않을게 너의 말투 표정 하나까지 담아갈게 흐린 하늘 멈춘 구름 왜 모든 게 두려울까 너와 있는 시간이 느려지고 자꾸 멀어질  니 손을 붙잡고 있어 I beg,발라드,256,2016-12-25,가을_새벽,산책/걷는중,기쁨
30169608,10025845,601979,에디킴,이쁘다니까,도깨비 OST Part.5,자꾸 물어보는 너 늘 확인하고픈 너 같은 말해줘도 매일 말해줘도 왜 계속 물어 입술이 말라오네 또 식은땀이 흐르네 또 정답은 알지만 니가 듣고 싶은 말 그 듣고 싶은 말 나를 시험하는 말 너 정말 이쁘다 이쁘다 이쁘다니까 왜 내 말 믿지 않는 건데 왜 말하고 말하고 아무리 말해도 화난 듯한 너의 그 표정 말 수가 없어진 너 더 불안해지는 나 매일 같은 퀴즈 반복되는 게임 난 항상 술래 머리를 새로 했나 오 손톱이 바뀌었을까 오 감이 오질 않아 니가 듣고 싶은 말 그 듣고 싶은 말 정말 힌트도 없는지 너 정말 이쁘다 이쁘다 이쁘다니까 왜 내 말 믿지 않는 건데,발라드,195,2016-12-24,봄_아침,산책/걷는중,슬픔
30177818,10027253,490981,소유 (SOYOU),I Miss You,도깨비 OST Part.7,바라보면 자꾸 눈물이 나는 건 왠지 몰라도 돌고 돌아 내게 오고 있었나요 피해지지 않는 그 사랑 I love u love u love u 인연인 걸 느꼈죠 난 And I miss u miss u 나의 운명인 사람 슬픈 눈빛으로 왜 나를 보나요 울지 말아요 한 눈에 날 알아본 건 아닌가요 이제서야 왜 내게 왔죠 I love u love u love u 인연인 걸 느꼈죠 난 And I miss u miss u 나의 운명인 사람 몇 번을 태어난대도 그대가 어딜 숨어도 나는 그댈 찾겠죠 다신 우리 헤어지지 마요 내 곁에서 떠나가지 말아요 떠나가지 말아요,발라드,170,2016-12-31,겨울_저녁,운동/훈련중,슬픔
30178900,10027400,242988,정준일,첫 눈,도깨비 OST Part.8,내 마음을 한번만 만져줘요 온종일 이렇게 서늘해요 겨울보다 차가운 하늘 그아래 내가 서 있으니 눈물도 얼어버릴듯 해 조용히 한번만 불러줘요 수없이 말하던 내 이름을 영원을 거슬러 하루를 아니 일분을 보게 돼도 그럴수 있다면 견뎌낼게 그 기다림 끝에 그대가 서있어주길 내겐 그림같았던 그대와 기억 아주 오래 기다렸던 선물같은 하루 긴 시간을 건너서 네게 닿을게 내 마음에 첫눈이던 그대 넌 언제나 내겐 아득하다 그대와의 시간 그 하루가 내겐 왜 이렇게 아픈가요 너의 옆에 내가 서 있고 서로 웃을수 있는 하루 그릴수 없어서 눈물나죠 이게 꿈이라면 내마음을 전해줄텐데 내겐 그림같았던 그대와 기억 아주오래 기다렸던 선물같은 하루 긴 시간을 건너서 네게 닿을게 내 마음에,발라드,296,2017-01-01,겨울_새벽,휴식/수면,안정
30190630,10029181,629831,에일리(AILEE),첫눈처럼 너에게 가겠다,도깨비 OST Part.9,널 품기 전 알지 못했다 내 머문 세상 이토록 찬란한 것을 작은 숨결로 닿은 사람 겁 없이 나를 불러준 사랑 몹시도 좋았다 너를 지켜보고 설레고 우습게 질투도 했던 평범한 모든 순간들이 캄캄한 영원 그 오랜 기다림 속으로 햇살처럼 니가 내렸다 널 놓기 전 알지 못했다 내 머문 세상 이토록 쓸쓸한 것을 고운 꽃이 피고 진 이 곳 다시는 없을 너라는 계절 욕심이 생겼다 너와 함께 살고 늙어가 주름진 손을 맞잡고 내 삶은 따뜻했었다고 단 한번 축복 그 짧은 마주침이 지나 빗물처럼 너는 울었다 한번쯤은 행복하고 싶었던 바람 너까지 울게 만들었을까 모두 잊고 살아가라 내가 널 찾을 테니 니 숨결 다시,발라드,230,2017-01-07,가을_새벽,휴식/수면,슬픔
30208070,10032040,960251,아이오아이 (I.O.I),소나기,소나기,이 비가 머리 위로 쏟아지면 흠뻑 젖고 말겠죠 내 마음도 머물러줘요 아직까진 그대 없이 나 혼자 이 비를 맞기엔 아직 어리고 조금 무서워 금방 그칠 거란걸 뻔히 다 알면서도 그댈 찾네요 이제 그만 다 그칠까 이 빗물도 내 눈물도 비에 젖어 추위에 떨고 싶진 않아요 정말 언젠간 너무 차디찼던 빗물이 따뜻한 눈물이 되어 흘러내리겠죠 괜찮아요 금방 지나갈 소나기죠 그냥 스쳐 지나가는 소나기죠 그런 감정이죠 나 정말 그대를 만나 행복했던 많은 추억들을 빗물에 잃지 않아요 내리는 비가 그칠 때쯤에 그때 다시 만나요 우리 다시 웃으며 함께 있을게요 이제 그만 다 그칠까 이 빗물도 내 눈물도 비에 젖어 추위에 떨고 싶진 않아요,발라드,234,2017-01-18,가을_새벽,휴식/수면,슬픔
30247520,10038305,490981,소유 (SOYOU),비가와 (Rain),비가와,비가 오던 우산 속  젖은 너의 어깨 끝  작은 떨림도 느낄 수 있었던  너와의 거리 비가 오던 정류장  바라보던 네 눈빛  너도 생각날까 밤새 나누던  우리의 얘기들 비가 내려 오늘도 아픈 비가와  너를 보냈던 그날처럼 말야  비가 내려 하필 또 잠도 못 자게  아직인가봐  난 아직도 널 기다리나 봐  비가 오던 그날 밤 사랑했던 너와 나 마지막까지 걱정하던 너 날 안아주던 너 비가 내려 오늘도 아픈 비가와 너를 보냈던 그날처럼 말야 비가 내려 하필 또 잠도 못 자게 아직인가봐 난 아직도 널 기다려 모든 건 영원할 수 없어서 우린,발라드,226,2017-02-14,가을_새벽,휴식/수면,안정
30278209,10040265,236797,태연 (TAEYEON),Fine,My Voice - The 1st Album,찢어진 종잇조각에  담아낸 나의 진심에 선명해져 somethin bout you Yeah 나를 많이 닮은 듯 다른 넌 혹시 나와 같을까 지금 괜한 기대를 해 하루 한 달 일 년쯤 되면 서로 다른 일상을 살아가 나는 아니야 쉽지 않을 것 같아 여전하게도 넌 내 하루하루를 채우고 아직은 아니야 바보처럼 되뇌는 나 입가에 맴도는 말을 삼킬 수 없어 Its not fine Ah Ah Ah Ah  Its not fine 머릴 질끈 묶은 채 어지러운 방을 정리해 찾고 있어 somethin new 가끔 이렇게 감당할 수 없는 뭐라도 해야 할 것만 같은 기분에 괜히 움직이곤 해 하루 한 달 일 년 그 쯤이면 웃으며,발라드,180,2017-02-28,봄_점심,차량/운전중,슬픔
30290011,10043982,570731,정키,부담이 돼 (Feat. 휘인 Of 마마무),EMPTY,더는 할 말이 없어 다른 이유도 어떤 변명도 난 의미 없단 걸 알아 끝이란 게 다 그렇잖아 더는 물어보지 마 언제부턴지 왜 그런 건지 난 그저 함께한 이 모든 게 힘들었다고 말하잖아 니 품에 안기던 그날 밤에도 입을 맞추던 그 순간에도 나에게 그 모든 게 더는 너에게 말할 수 없는 상처로 남아 내겐 그 모든 게 다 부담이 돼 그렇게 내게 말하지 마 나도 내 맘을 어쩔 수 없는 걸 오늘까지도 많이 힘들었단 걸 너는 알고 있잖아 니 품에 안기던 그날 밤에도 입을 맞추던 그 순간에도 나에게 그 모든 게 더는 너에게 말할 수 없는 상처로 남아 내겐 그 모든,발라드,258,2017-03-08,가을_새벽,산책/걷는중,사랑
30314784,10047890,261143,IU (아이유),밤편지,밤편지,이 밤 그날의 반딧불을 당신의 창 가까이 보낼게요 음 사랑한다는 말이에요 나 우리의 첫 입맞춤을 떠올려 그럼 언제든 눈을 감고 음 가장 먼 곳으로 가요 난 파도가 머물던 모래 위에 적힌 글씨처럼 그대가 멀리 사라져 버릴 것 같아 늘 그리워 그리워 여기 내 마음속에 모든 말을 다 꺼내어 줄 순 없지만 사랑한다는 말이에요 어떻게 나에게 그대란 행운이 온 걸까 지금 우리 함께 있다면 아 얼마나 좋을까요 난 파도가 머물던 모래 위에 적힌 글씨처럼 그대가 멀리 사라져 버릴 것 같아 또 그리워 더 그리워 나의 일기장 안에 모든 말을 다 꺼내어 줄 순 없지만 사랑한다는 말 이 밤 그날의 반딧불을 당신의,발라드,253,2017-03-24,가을_새벽,휴식/수면,슬픔
30378157,10056666,261143,IU (아이유),이런 엔딩,Palette,안녕 오랜만이야 물음표 없이 참 너다운 목소리 정해진 규칙처럼 추운 문가에 늘 똑같은 네 자리 제대로 잘 먹어 다 지나가니까 예전처럼 잠도 잘 자게 될 거야  진심으로 빌게  너는 더 행복할 자격이 있어 그런 말은 하지 마 제발 그 말이 더 아픈 거 알잖아 사랑해줄 거라며 다 뭐야 어떤 맘을 준 건지 너는 모를 거야 외로웠던 만큼 너를 너보다 사랑해줄 사람  꼭 만났으면 해 내가 아니라서 미안해 주는 게 쉽지가 않아 그런 말은 하지 마 제발 그 말이 더 아픈 거 알잖아 사랑해줄 거라며 다 뭐야 어떤 맘을 준 건지 끝내 모를 솔직히 말해줄래 제발 너라면 다,발라드,249,2017-04-21,겨울_새벽,휴식/수면,기쁨
30378164,10056666,261143,IU (아이유),이름에게,Palette,꿈에서도 그리운 목소리는 이름 불러도 대답을 하지 않아 글썽이는 그 메아리만 돌아와 그 소리를 나 혼자서 들어 깨어질 듯이 차가워도 이번에는 결코 놓지 않을게 아득히 멀어진 그날의 두 손을 끝없이 길었던 짙고 어두운 밤 사이로 조용히 사라진 네 소원을 알아 오래 기다릴게 반드시 너를 찾을게 보이지 않도록 멀어도 가자 이 새벽이 끝나는 곳으로 어김없이 내 앞에 선 그 아이는 고개 숙여도 기어이 울지 않아 안쓰러워 손을 뻗으면 달아나 텅 빈 허공을 나 혼자 껴안아 에어질 듯이 아파와도  이번에는 결코 잊지 않을게 한참을 외로이 기다린 그 말을 끝없이 길었던 짙고 어두운 밤 사이로 영원히 사라진 네 소원을 알아 오래 기다릴게,발라드,290,2017-04-21,가을_새벽,휴식/수면,슬픔
30383759,10057543,544520,종현 (JONGHYUN),1000,종현 소품집 '이야기 Op.2',하나 둘 셋 또 하루가 금세 지나가 하나 둘 셋 또 내일이 코앞에 와서 내 어깰 짓눌러 그림자를 붙들어 편히 쉴 곳이 난 필요한 듯해 아마도 너와 난 꼭 그때가 아니었더라도 너와 난 분명 만났을 거야 시간이 꽤 지났지만 처음과 다르진 않아 여전해 난 복받은 사람이야 그대 날 안아줘 내 어깨에 기대줘 단단히 날 믿어줘 넌 알잖아 말 안 해도 안다는 말 가슴 뭉클한 말인 건 맞지만 다 알아도 말해줘 시간은 참 빨라서 어색하기만 하던 나도 변했어 참 웃겼어 작은 실수에도 안절부절못하던 내 모습도 웃으며 기다려 준 것도 너뿐이야 난 참 운도 좋아 아마도 너와 난 꼭 그때가 아니었더라도 너와,발라드,242,2017-04-24,봄_새벽,휴식/수면,슬픔
30399360,10059997,711476,한동근,미치고 싶다,한동근 1ST ALBUM 'Your Diary',환상을 본 적이 있나요 전 있어요 아지랑이 같은 색깔이죠 텅 빈 이 벤치에 그대가 보이네요 투명하고 연기 같긴 해도 넋이 나간 날 보면서 모두 미쳤냐고 해요 뭐 그래요 그대만 보인다면야 미친 게 꼭 나쁘지는 않네요 그래요 차라리 더 미쳐서 보고 싶죠 그대가 어딨어 어딨어 도대체 어디서 뭘 하고 있어 난 이렇게나 망가지고 있는데 갈수록 더 많이 보여요 맘 아프게 돌아올 것 같은 모습으로 그대 보인다고 하면 정신 차리라고 해요 뭐 그래요 그대만 보인다면야 미친 게 꼭 나쁘지는 않네요 그래요 차라리 더 미쳐서 보고 싶죠 그대가 어딨어 어딨어 도대체 어디서 뭘 하고 있어 난 이렇게나 망가지고 있는데 진짜 같은 네가 안아주는,발라드,215,2017-05-05,겨울_새벽,산책/걷는중,슬픔
30414090,10062351,792022,볼빨간사춘기,처음부터 너와 나,군주 - 가면의 주인 OST Part.2,Baby you  나의 사랑 그대  널 보면 너 함께 있으면  어둠은 사라져 시간은 멈춰서  이 공간엔 너와 나 둘만  남겨져 Love was always painful  널 알기 전 사실 나 두렵던  사랑이란 감정 날 울리던 함정  그렇게만 생각했는데  내 안에 빛이 되어줘  나의 맘을 알아줘  내 세상에 밝은 별이 되어줘  후회하지 않을게  너의 이유 되어 줄게  처음부터 너와 나인 것처럼  가슴이 멎은 것처럼  아련해지는 걸  내 하루는 이미 너 하나인 걸  사랑한단 이유로  상처 주진 않을게  처음부터 너와 나인 것처럼 ,발라드,204,2017-05-17,겨울_저녁,차량/운전중,안정
30467550,10070673,205746,황치열,매일 듣는 노래 (A Daily Song),Be Ordinary,힘든 하루 끝에 집 앞에 거리를 서성이다 돋아나는 이 공허함에 그 노래를 um 나도 모르게 또 이렇게 흥얼거리고 있어 아마 너를 애타게 너를 부르듯이 세상에서 이 노래가 제일 좋다며 들려주던 함께 듣던 노래 너무 슬픈 이 노래 매일 듣는 이 노래가 또 매일 울려 이 노래가 널 떠올리게 만들어 다 우리 얘기만 같아서 아무리 귀를 막아봐도 자꾸 맴돌아 듣고 싶지 않아 몸부림쳐도 매일 듣는 노래 시간이 지나도 이 노랜 잊혀지질 않았어 가사 하나 멜로디까지 선명해서 네 앞에서 불러주려 매일 매일 혼자 연습했던 함께 듣던 노래 가슴 아픈 이 노래 매일 듣는 이 노래가 또 매일 울려 이 노래가 널 떠올리게,발라드,259,2017-06-13,가을_새벽,휴식/수면,슬픔
30486509,10073513,437,윤종신,좋니,LISTEN 010 좋니,이제 괜찮니 너무 힘들었잖아 우리 그 마무리가 고작 이별뿐인 건데  우린 참 어려웠어 잘 지낸다고 전해 들었어 가끔 벌써 참 좋은 사람 만나 잘 지내고 있어 굳이 내게 전하더라 잘했어 넌 못 참았을 거야 그 허전함을 견뎌 내기엔 좋으니 사랑해서 사랑을 시작할 때 니가 얼마나 예쁜지 모르지 그 모습을 아직도 못 잊어 헤어 나오지 못해 니 소식 들린 날은 더 좋으니 그 사람 솔직히 견디기 버거워 니가 조금 더 힘들면 좋겠어 진짜 조금 내 십 분의 일 만이라도 아프다 행복해 줘 억울한가 봐 나만 힘든 것 같아 나만 무너진 건가 고작 사랑 한번 따위  나만 유난 떠는 건지,발라드,328,2017-06-22,가을_새벽,산책/걷는중,슬픔
30514366,10078176,839732,멜로망스,선물,Moonlight,빛이 들어오면 자연스레 뜨던 눈 그렇게 너의 눈빛을 보곤 사랑에 눈을 떴어 항상 알고 있던 것들도 어딘가 새롭게 바뀐 것 같아 남의 얘기 같던 설레는 일들이 내게 일어나고 있어 나에게만 준비된 선물 같아 자그마한 모든 게 커져만 가 항상 평범했던 일상도 특별해지는 이 순간 별생각 없이 지나치던 것들이 이제는 마냥 내겐 예뻐 보이고 내 맘을 설레게 해 항상 어두웠던 것들도 어딘가 빛나고 있는 것 같아 남의 얘기 같던 설레는 일들이 내게 일어나고 있어 나에게만 준비된 선물 같아 자그마한 모든 게 커져만 가 항상 평범했던 일상도 특별해지는 이 순간 너를 알게 된 뒤 보이는 모든 것들이 너무 예뻐 보여 그렇게 신난,발라드,261,2017-07-10,가을_새벽,휴식/수면,슬픔
30550388,10083290,41499,박원,all of my life,0M,너무 힘들어 삶에 치이고  되는 것도 없고  가족도 안 보이고  언제부턴가 나도 중요하지 않고 없진 않지만 더 많이 가져야 사랑도 이어갈 수 있는 이 세상에서 all of my life you are all of my life 그러고 보면 나  너를 만나 참 많이 변했어  꿈이 생기고 네가 가진 꿈도  이뤄주고 싶었어 나 그러려면 더 높은 곳에 올라가야만 했어 더 많은 것들을 가져야 가능했어 다 가질 때쯤 사랑보다 꿈이 더 커졌어 all of my life  내가 힘이 들 때 you are all of my life  네가 날 채웠는데  다른 어떤 걸로 나를 채워봐도,발라드,249,2017-07-27,가을_새벽,산책/걷는중,슬픔
30616707,10093774,772253,잔나비,She (Hidden Track No.V 1월 선정곡),She,she is everything to me 지친 나를 감싸 안아줄 그대 나를 반겨줄 천사 같은 이름 woo she she 그 미소 위로 닻을 내리고 내 하루가 쉬어가고 she 어떨까요 그대 없는 나는 all of my life is you 빰빰빰 빰 빰 빰빰빰 빰 빰 무지개가 떨어진 곳을 알아 내일은 꼭 함께 가자는 그녀 내 손을 감싸 쥐는 용감한 여전사여 woo she she 그 미소 위로 닻을 내리고 내 하루가 쉬어가고 she 어떨까요 그대 없는 나는 all of my life all of my life is you she 어떤 밤에는 그대와 나는 길을 잃고 헤매겠지 she 걸음 맞춰서 걷다가 보면 all of my,발라드,194,2017-09-09,겨울_새벽,산책/걷는중,슬픔
30637776,10097064,500421,길구봉구,이 별,Star,함께였었던 너 지금 어느 별에 있니 난 아직도 이별에 있어 흩어져가는 하늘에 나를 태워 보면 볼 수 있을까 너 있는 곳에 혹시 너도 나를 찾고서 있는지 마치 시간이 멈춘 듯이 너를 기다리고만 있어 oh youre my star oh youre my star in the sky 너의 밤하늘 속에 내가 있다면 그 수 많은 별들 중에 한 점이라도 채워지면 그걸로 좋아 이별이 된대도 함께였었던 너 지금 어느 별에 있니 난 아직도 이별에 있어 환하게 웃어주던 니 마지막 모습이 그리워 꿈에서 라도 만날까 너를 품에 안고 잠들어 oh youre my star oh youre my star in the sky 너의 밤하늘 속에 내가 있다면,발라드,238,2017-09-18,가을_새벽,산책/걷는중,슬픔
30660684,10100702,756533,휘인 (Whee In),그림자,Yellow OST Part.1,너의 그림자 뒷모습 난 익숙하지 너를 그리는 내 하루는 길고 또 반복돼 작은 친절에 떨림이 넘치곤 하지만 우연을 기다려 너의 뒤에서 니가 지나간 자리 외로워도 더 원해 스치듯 지나가버린  다정한 향기 까지도 지쳐 잠든 새벽 꿈에서도 널 원해  하루에 일초라도 내 곁에 있어줘 머물러줘 기나긴 계절의 기다림 난 익숙하지 널 바라보는데 가슴은 왜이리 아프니 나를 비워내며 널 채워가고 있지만 너의 마음을 갖긴 어려워 니가 지나간 자리 외로워도 더 원해 스치듯 지나가버린  다정한 향기 까지도 지쳐 잠든 새벽 꿈에서도 널 원해  하루에 일초라도 내 곁에 있어줘 너의 세상엔 내가 없어 난 너무 잘 알죠  점점 약해지는,발라드,226,2017-10-06,여름_새벽,휴식/수면,슬픔
30669593,10102177,175155,먼데이 키즈 (Monday Kiz),가을 안부,가을 안부,어떠니 잘 지냈니 지난 여름 유난히도 힘에 겹더라 올핸 새벽녘엔 제법 쌀쌀한 바람이 어느덧 니가 좋아하던 그 가을이 와 사랑도 그러게 별수없나 봐 언제 그랬냐는 듯 계절처럼 변해가 그리워져 미치도록 사랑한 그날들이 내 잃어버린 날들이 참 많이 웃고 울었던 그때 그 시절의 우리 니가 떠올라 밤새 참 아프다 니가 너무 아프다 너를 닮은 이 시린 가을이 오면 보고 싶어서 너를 안고 싶어서 가슴이 너를 앓는다 어떠니 넌 괜찮니 지금쯤은 나를 잊고 편안해졌니 이젠 우습지 잘살길 바라면서도 막상 날 잊었을 널 떠올리면 서글퍼 그리워져 미치도록 사랑한 그날들이 내 잃어버린 날들이 참 많이 웃고 울었던 그때 그 시절의 우리 니가 떠올라 밤새,발라드,303,2017-10-14,가을_새벽,산책/걷는중,슬픔
30672529,10102658,647971,비투비,그리워하다,Brother Act.,My life is incomplete Its Missing you 오늘도 하루를 보내 다를 게 없이 하나도 안 어색해 혼자 있는 게 너 없인 안될 것 같던 내가 이렇게 살아 근데 좀 허전해 난 여전히 거기 있나 봐 후련하게 다 털어내 다 다 지난 일에 마음 쓰는 게  Its alright 답이 잘 보이는가 싶다가도 어느새 날 가두는 감옥이 돼 시간은 앞으로만 가는 걸 어째 그 동안 난 아무것도 이룬 것이 없네 아직도 내 마음속엔 너 Oh oh 너를 그리워하다 하루가 다 지났어 너를 그리워하다 일 년이 가버렸어 난 그냥 그렇게 살아 너를 그리워하다 그리워하다 다 괜찮을 거라 되뇌어 봐도 내 하루에 끝엔,발라드,237,2017-10-16,가을_새벽,산책/걷는중,안정
